ID,Title,Location,Summary
118b90820b1c0457,[대형증권사] 플랫폼/Back-end 엔지니어,서울 강남구,그래머>웹개발|인터넷·IT·통신·모바일·게임>웹프로그래머>JAVA|인터넷·IT·통신·모바일·게임>웹프로그래머> Python|인터넷·IT·통신·모바일·게임>웹프로그래머>HTML·DHTML·mHTML|인터넷·IT·통신·모바일·게임...
21c194fa8f26dacb,Data Engineer (토스뱅크),서울 강남구,"환경에서 대용량의 데이터를 실시간으로 분산처리하여 데이터 기반 토스뱅크 서비스에 기여해요.동료들의 분석환경( Python, SAS, ML 등)을 모두 지원가능한, 쉽게 조회가 가능한 데이터 플랫폼을 구축해요. 인터넷·IT·통신..."
9f7ad2b23171f074,Enterprise Technical Support,서울,"scripts using one or more... following languages - Python, Java, Javascript, or Typescript Our customers come from all..."
781ff208e96d815c,(주)케이엠티엘 건설분야 R&D 병역특례(전문연구요원(영상관련 S/W 개발)),서울 구로구,"우대사항]컴퓨터비전, 인공지능 분야 전공자 소프트웨어 개발자(C#, Python 등) 영상처리 기술 (OpenCV 활용기술 및 상용 Library... 통신·모바일·게임>응용프로그래머> Python|인터넷·IT·통신·모바일·게임..."
ac64fda2e281b835,"Software Engineer, People with Disabilities (장애인 채용)",서울,"languages, including... limited to: C++, Java, C and Python. Experience in a variety of projects utilizing natural..."
1399ee2f387a27dd,카카오 전체의 계정 플랫폼을 만들 서버개발자 모집,성남 판교역,"를 사용한 웹어플리케이션 개발 하둡 에코시스템을 활용한 대용량 데이터 처리 Ruby on Rails, Python 을 사용한 개발 Kafka, Redis, Elastic Search 등을 활용한 개발 함께 성장하고 싶다면..."
8dc9b881b447c3be,"추천 시스템 백엔드 개발자 경력직, 정규직",서울 중구,"있으신 분• Kurbernetes, Docker와 같은 컨테이너 환경에 익숙하거나 개발 경험이 있으신 분• Python, Javascript 등의 스크립트 언어 사용 경험이 있으신 분 1 명 근무조건 고용형태: 정규직(수습기..."
89b2f784c88c8a1b,[신입/경력] SW Engineer/Backend/Frontend 개발자,서울 서초구,인터넷·IT·통신·모바일·게임>웹프로그래머>백엔드|인터넷·IT·통신·모바일·게임>웹프로그래머>프론트엔드|인터넷·IT·통신·모바일·게임>응용프로그래머>인공지능(AI)|인터넷·IT·통신·모바일·게임>응용프로그래머> Python
e91b5984e7f5d3fd,"데이터베이스개발자, 웹개발 신입/경력 정규직",서울 영등포구,"개발자 ㆍCss/html 등 웹디자인 관련 유경험자 ㆍ자바스크립트, Python, C++, 닷넷 등 ㆍNode, Selenium, electron... 관련 유경험자ㆍ자바스크립트, Python, C++, 닷넷 등 ㆍNode..."
